id,title,release_date,popularity,vote_average,vote_count,overview
1,Toy Story,1995-10-30,21.95,7.7,5415,"A cowboy doll is profoundly threatened when a new spaceman figure supplants him as top toy."
2,Jumanji,1995-12-15,17.02,6.9,2413,"When two kids play a magical board game, they release a man trapped inside and a host of dangers."
3,Grumpier Old Men,1995-12-22,11.71,6.5,92,"A family comedy about feuding neighbors finding love."
4,Waiting to Exhale,1995-12-22,3.86,6.1,34,"Four African-American women share their experiences with men and relationships."
5,Father of the Bride Part II,1995-12-08,8.39,6.0,173,"George Banks deals with becoming a grandfather while his daughter is pregnant."
